"read code","disease","medcode","descr","category","disease_num","system","system_num","medcodeid","snomedctconceptid","snomedctdescriptionid","mapping"
NA,"Peripheral Vascular Disease",NA,"Angioplasty of femoral artery",NA,115,"Diseases of the Circulatory System",2,"931881000006115","175715003","931881000006115","termsearch"
NA,"Peripheral Vascular Disease",NA,"Dressing of leg ulcer",NA,115,"Diseases of the Circulatory System",2,"1997621000006116","805211000000103","1799991000000118","termsearch"
NA,"Peripheral Vascular Disease",NA,"Leg ulcer",NA,115,"Diseases of the Circulatory System",2,"931941000006116","267816005","931941000006116","termsearch"
NA,"Peripheral Vascular Disease",NA,"Mixed arteriovenous leg ulcer",NA,115,"Diseases of the Circulatory System",2,"5126401000006115","238792006","357892011","termsearch"
NA,"Peripheral Vascular Disease",NA,"Periph. vasc. complications",NA,115,"Diseases of the Circulatory System",2,"900131000006111","213217008","900131000006111","termsearch"
NA,"Peripheral Vascular Disease",NA,"Peripheral vasc. disease NOS",NA,115,"Diseases of the Circulatory System",2,"884611000006112","646351000000103","884611000006112","termsearch"
NA,"Peripheral Vascular Disease",NA,"Peripheral vasc. disease NOS",NA,115,"Diseases of the Circulatory System",2,"884621000006116","646351000000103","884621000006116","termsearch"
NA,"Peripheral Vascular Disease",NA,"Peripheral vascular disease annual review",NA,115,"Diseases of the Circulatory System",2,"1696201000006114","1696201000006105","1696201000006114","termsearch"
NA,"Peripheral Vascular Disease",NA,"Peripheral vascular disease monitoring administration",NA,115,"Diseases of the Circulatory System",2,"1696211000006112","1696211000006108","1696211000006112","termsearch"
NA,"Peripheral Vascular Disease",NA,"Reason for referral: Leg Ulcer",NA,115,"Diseases of the Circulatory System",2,"1776781000006112","1776781000006108","1776781000006112","termsearch"
NA,"Peripheral Vascular Disease",NA,"Varicose ulcer of leg",NA,115,"Diseases of the Circulatory System",2,"884771000006113","195445008","884771000006113","termsearch"
NA,"Peripheral Vascular Disease",NA,"Varicose ulcer of leg",NA,115,"Diseases of the Circulatory System",2,"989231000006113","195445008","989231000006113","termsearch"
NA,"Peripheral Vascular Disease",NA,"[RFC] Diabetic foot/leg ulcer",NA,115,"Diseases of the Circulatory System",2,"906711000006116","906711000006100","906711000006116","termsearch"
NA,"Peripheral Vascular Disease",NA,"[RFC] Diabetic leg ulcer",NA,115,"Diseases of the Circulatory System",2,"910491000006117","910491000006101","910491000006117","termsearch"
NA,"Peripheral Vascular Disease",NA,"[RFC] Leg ulcer",NA,115,"Diseases of the Circulatory System",2,"906671000006115","906671000006104","906671000006115","termsearch"
NA,"Peripheral Vascular Disease",NA,"[RFC] Leg ulcer",NA,115,"Diseases of the Circulatory System",2,"909541000006117","909541000006101","909541000006117","termsearch"
NA,"Peripheral Vascular Disease",NA,"[RFC] Leg ulcer - arterial",NA,115,"Diseases of the Circulatory System",2,"908901000006115","908901000006104","908901000006115","termsearch"
NA,"Peripheral Vascular Disease",NA,"[RFC] Leg ulcer - both arterial & venous",NA,115,"Diseases of the Circulatory System",2,"908911000006117","908911000006101","908911000006117","termsearch"
NA,"Peripheral Vascular Disease",NA,"[RFC] Leg ulcer - venous",NA,115,"Diseases of the Circulatory System",2,"908891000006119","908891000006103","908891000006119","termsearch"
NA,"Peripheral Vascular Disease",NA,"[RFC] Leg ulcer of mixed aetiology",NA,115,"Diseases of the Circulatory System",2,"908411000006114","908411000006105","908411000006114","termsearch"
NA,"Peripheral Vascular Disease",NA,"[RFC] Peripheral vascular disease",NA,115,"Diseases of the Circulatory System",2,"906771000006113","906771000006109","906771000006113","termsearch"
NA,"Peripheral Vascular Disease",NA,"[RFC] Post leg ulcer care",NA,115,"Diseases of the Circulatory System",2,"910511000006111","910511000006107","910511000006111","termsearch"
"","Peripheral Vascular Disease","","insulin dependent diab mell with peripheral angiopathy","Peripheral vascular disease (7)",115,"Diseases of the Circulatory System",2,"913921000006119","421895002","2618203015","description"
"","Peripheral Vascular Disease","","ischaemic foot","Peripheral vascular disease (7)",115,"Diseases of the Circulatory System",2,"1699111000006110","1699111000006106","1699111000006110","originalreadcode"
"","Peripheral Vascular Disease","","niddm with peripheral circulatory disorder","Peripheral vascular disease (7)",115,"Diseases of the Circulatory System",2,"12485441000006119","422166005","674961000006118","originalreadcode"
"","Peripheral Vascular Disease","","peripheral arterial embolism and thrombosis nos","Peripheral vascular disease (7)",115,"Diseases of the Circulatory System",2,"12733151000006114","583731000000103","1295391000000110","originalreadcode"
"","Peripheral Vascular Disease","","peripheral vascular disease nos","Peripheral vascular disease (7)",115,"Diseases of the Circulatory System",2,"12729241000006119","646351000000103","1422221000000115","originalreadcode"
"","Peripheral Vascular Disease","","type 1 diabetes mellitus with peripheral angiopathy","Peripheral vascular disease (7)",115,"Diseases of the Circulatory System",2,"84411000006111","31211000119101","3315042015","description"
"","Peripheral Vascular Disease","","type ii diabetes mellitus with peripheral angiopathy","Peripheral vascular disease (7)",115,"Diseases of the Circulatory System",2,"459306016","314902007","459306016","description"
"2G63.00","Peripheral Vascular Disease","9561","Ischaemic toe","Peripheral vascular disease (7)",115,"Diseases of the Circulatory System",2,"450665015","307408003","450665015","cleansedreadcode"
"7A10000","Peripheral Vascular Disease","95573","Emerg aortic bypass by anastomosis axillary to femoral art","Other PAD procedures (3)",115,"Diseases of the Circulatory System",2,"639341000006115","175276005","271413015","cleansedreadcode"
"7A10100","Peripheral Vascular Disease","23352","Bypass aorta by anastomosis axillary to femoral artery NEC","Other PAD procedures (3)",115,"Diseases of the Circulatory System",2,"530051000006117","233379008","349697018","cleansedreadcode"
"7A10200","Peripheral Vascular Disease","34153","Axillo-bifemoral bypass graft","Other PAD procedures (3)",115,"Diseases of the Circulatory System",2,"501011000006118","388997005","1493587018","cleansedreadcode"
"7A10300","Peripheral Vascular Disease","40302","Axillo-unifemoral PTFE bypass graft","Other PAD procedures (3)",115,"Diseases of the Circulatory System",2,"271416011","175279003","271416011","cleansedreadcode"
"7A12.00","Peripheral Vascular Disease","36952","Other bypass of bifurcation of aorta","Other PAD procedures (3)",115,"Diseases of the Circulatory System",2,"271431019","233373009","349683014","cleansedreadcode"
"7A12000","Peripheral Vascular Disease","48755","Emerg bypass bifurc aorta by anast aorta to femoral artery","Other PAD procedures (3)",115,"Diseases of the Circulatory System",2,"639371000006111","175290008","271432014","cleansedreadcode"
"7A12100","Peripheral Vascular Disease","2761","Bypass bifurc aorta by anastom aorta to femoral artery NEC","Other PAD procedures (3)",115,"Diseases of the Circulatory System",2,"530061000006115","448171003","2900875010","cleansedreadcode"
"7A12111","Peripheral Vascular Disease","14895","Aorto bifemoral graft","Other PAD procedures (3)",115,"Diseases of the Circulatory System",2,"224121000000118","233373009","349688017","cleansedreadcode"
"7A12112","Peripheral Vascular Disease","28166","Dacron aortofemoral Y graft","Other PAD procedures (3)",115,"Diseases of the Circulatory System",2,"410961010","275038008","410961010","cleansedreadcode"
"7A12300","Peripheral Vascular Disease","15532","Bypass bifurcation aorta by anastom aorta to iliac artery","Other PAD procedures (3)",115,"Diseases of the Circulatory System",2,"530071000006110","265495003","394305010","cleansedreadcode"
"7A12311","Peripheral Vascular Disease","3778","Aorto biiliac graft","Other PAD procedures (3)",115,"Diseases of the Circulatory System",2,"488631000006116","265495003","394305010","cleansedreadcode"
"7A12312","Peripheral Vascular Disease","42465","Dacron aortoiliac Y graft","Other PAD procedures (3)",115,"Diseases of the Circulatory System",2,"410962015","275039000","410962015","cleansedreadcode"
"7A12y00","Peripheral Vascular Disease","55825","Other specified other bypass of bifurcation of aorta","Other PAD procedures (3)",115,"Diseases of the Circulatory System",2,"271444012","233373009","349683014","cleansedreadcode"
"7A12z00","Peripheral Vascular Disease","64798","Other bypass of bifurcation of aorta NOS","Other PAD procedures (3)",115,"Diseases of the Circulatory System",2,"271445013","233373009","349683014","cleansedreadcode"
"7A19200","Peripheral Vascular Disease","55402","Open embolectomy of bifurcation of aorta","Other PAD procedures (3)",115,"Diseases of the Circulatory System",2,"271509013","175348000","271509013","cleansedreadcode"
"7A41.00","Peripheral Vascular Disease","21927","Other bypass of iliac artery","Other PAD procedures (3)",115,"Diseases of the Circulatory System",2,"394323019","405477007","2157280014","cleansedreadcode"
"7A41000","Peripheral Vascular Disease","44250","Emerg bypass iliac art by iliac/femoral art anastomosis NEC","Other PAD procedures (3)",115,"Diseases of the Circulatory System",2,"639471000006115","51018000","85012019","cleansedreadcode"
"7A41100","Peripheral Vascular Disease","28616","Bypass iliac artery by iliac/femoral artery anastomosis NEC","Other PAD procedures (3)",115,"Diseases of the Circulatory System",2,"530201000006110","51018000","1780391000000113","cleansedreadcode"
"7A41200","Peripheral Vascular Disease","72448","Emerg bypass iliac artery by femoral/femoral art anast NEC","Other PAD procedures (3)",115,"Diseases of the Circulatory System",2,"639491000006119","233380006","349698011","cleansedreadcode"
"7A41211","Peripheral Vascular Disease","43648","Emergency femoro-femoral prosthetic cross over graft","Other PAD procedures (3)",115,"Diseases of the Circulatory System",2,"640081000006119","275040003","410963013","cleansedreadcode"
"7A41300","Peripheral Vascular Disease","36443","Bypass iliac artery by femoral/femoral art anastomosis NEC","Other PAD procedures (3)",115,"Diseases of the Circulatory System",2,"530191000006112","233380006","349698011","cleansedreadcode"
"7A41311","Peripheral Vascular Disease","30989","Femoro-femoral prosthetic cross over graft","Other PAD procedures (3)",115,"Diseases of the Circulatory System",2,"668731000006114","175685004","272001019","cleansedreadcode"
"7A41400","Peripheral Vascular Disease","68141","Emerg bypass comm iliac art by aorta/com iliac art anast NEC","Other PAD procedures (3)",115,"Diseases of the Circulatory System",2,"639391000006112","116360008","183983017","cleansedreadcode"
"7A41600","Peripheral Vascular Disease","66917","Emerg bypass leg artery by aorta/com fem art anastomosis NEC","Other PAD procedures (3)",115,"Diseases of the Circulatory System",2,"639521000006117","116360008","183983017","cleansedreadcode"
"7A41900","Peripheral Vascular Disease","32492","Bypass common iliac artery by aorta/com iliac art anast NEC","Other PAD procedures (3)",115,"Diseases of the Circulatory System",2,"530091000006111","116360008","183983017","cleansedreadcode"
"7A41B00","Peripheral Vascular Disease","55554","Bypass leg artery by aorta/com femoral art anastomosis NEC","Other PAD procedures (3)",115,"Diseases of the Circulatory System",2,"530221000006117","116360008","183983017","cleansedreadcode"
"7A41C00","Peripheral Vascular Disease","66804","Bypass leg artery by aorta/deep femoral art anastomosis NEC","Other PAD procedures (3)",115,"Diseases of the Circulatory System",2,"530231000006119","405482000","2157285016","cleansedreadcode"
"7A41F00","Peripheral Vascular Disease","41768","Ilio-femoral prosthetic cross over graft","Other PAD procedures (3)",115,"Diseases of the Circulatory System",2,"785611000006113","175594003","271866014","cleansedreadcode"
"7A41y00","Peripheral Vascular Disease","52357","Other specified other bypass of iliac artery","Other PAD procedures (3)",115,"Diseases of the Circulatory System",2,"271867017","116360008","183983017","cleansedreadcode"
"7A41z00","Peripheral Vascular Disease","38921","Other bypass of iliac artery NOS","Other PAD procedures (3)",115,"Diseases of the Circulatory System",2,"271868010","116360008","183983017","cleansedreadcode"
"7A42.00","Peripheral Vascular Disease","39039","Reconstruction of iliac artery","Other PAD procedures (3)",115,"Diseases of the Circulatory System",2,"394326010","265516003","394326010","cleansedreadcode"
"7A42.11","Peripheral Vascular Disease","63280","Reconstruction of common iliac artery","Other PAD procedures (3)",115,"Diseases of the Circulatory System",2,"349652010","233345007","349652010","cleansedreadcode"
"7A42000","Peripheral Vascular Disease","62818","Endarterectomy and patch repair of iliac artery","Other PAD procedures (3)",115,"Diseases of the Circulatory System",2,"641691000006118","265517007","394327018","cleansedreadcode"
"7A42011","Peripheral Vascular Disease","36065","Endarterectomy and patch repair of common iliac artery","Other PAD procedures (3)",115,"Diseases of the Circulatory System",2,"410964019","275041004","410964019","cleansedreadcode"
"7A42012","Peripheral Vascular Disease","59602","Iliac endarterectomy and patch","Other PAD procedures (3)",115,"Diseases of the Circulatory System",2,"394328011","265517007","394328011","cleansedreadcode"
"7A42100","Peripheral Vascular Disease","51211","Endarterectomy of iliac artery NEC","Other PAD procedures (3)",115,"Diseases of the Circulatory System",2,"394329015","307800001","451173017","cleansedreadcode"
"7A42111","Peripheral Vascular Disease","44430","Endarterectomy of common iliac artery NEC","Other PAD procedures (3)",115,"Diseases of the Circulatory System",2,"410965018","233304004","349571019","cleansedreadcode"
"7A42y00","Peripheral Vascular Disease","50894","Other specified reconstruction of iliac artery","Other PAD procedures (3)",115,"Diseases of the Circulatory System",2,"271880019","265516003","394326010","cleansedreadcode"
"7A42z00","Peripheral Vascular Disease","62866","Reconstruction of iliac artery NOS","Other PAD procedures (3)",115,"Diseases of the Circulatory System",2,"271881015","265516003","394326010","cleansedreadcode"
"7A43.00","Peripheral Vascular Disease","51331","Other open operations on iliac artery","Other PAD procedures (3)",115,"Diseases of the Circulatory System",2,"394330013","265511008","394321017","cleansedreadcode"
"7A43.11","Peripheral Vascular Disease","53580","Other open operations on common iliac artery","Other PAD procedures (3)",115,"Diseases of the Circulatory System",2,"410966017","265511008","394321017","cleansedreadcode"
"7A43000","Peripheral Vascular Disease","61256","Repair of iliac artery NEC","Other PAD procedures (3)",115,"Diseases of the Circulatory System",2,"394331012","450703003","2916807015","cleansedreadcode"
"7A43011","Peripheral Vascular Disease","66437","Repair of common iliac artery NEC","Other PAD procedures (3)",115,"Diseases of the Circulatory System",2,"410967014","450704009","2916913013","cleansedreadcode"
"7A43100","Peripheral Vascular Disease","61255","Open embolectomy of iliac artery","Other PAD procedures (3)",115,"Diseases of the Circulatory System",2,"394332017","265521000","394332017","cleansedreadcode"
"7A43111","Peripheral Vascular Disease","47562","Open embolectomy of common iliac artery","Other PAD procedures (3)",115,"Diseases of the Circulatory System",2,"411214011","275254000","411214011","cleansedreadcode"
"7A43300","Peripheral Vascular Disease","34037","Open insertion of iliac artery stent","Other PAD procedures (3)",115,"Diseases of the Circulatory System",2,"455900010","312226000","455900010","cleansedreadcode"
"7A44000","Peripheral Vascular Disease","10827","Percutaneous transluminal angioplasty of iliac artery","Other PAD procedures (3)",115,"Diseases of the Circulatory System",2,"271900018","175612005","271900018","cleansedreadcode"
"7A44100","Peripheral Vascular Disease","66930","Percutaneous transluminal embolectomy of iliac artery","Other PAD procedures (3)",115,"Diseases of the Circulatory System",2,"271901019","175613000","271901019","cleansedreadcode"
"7A44300","Peripheral Vascular Disease","7111","Insertion of iliac artery stent","Other PAD procedures (3)",115,"Diseases of the Circulatory System",2,"271905011","175615007","271905011","cleansedreadcode"
"7A44400","Peripheral Vascular Disease","24229","Percutaneous transluminal insertion of iliac artery stent","Other PAD procedures (3)",115,"Diseases of the Circulatory System",2,"455901014","312227009","455901014","cleansedreadcode"
"7A44y00","Peripheral Vascular Disease","28894","Other specified transluminal operation on iliac artery","Other PAD procedures (3)",115,"Diseases of the Circulatory System",2,"271907015","265522007","394333010","cleansedreadcode"
"7A44z00","Peripheral Vascular Disease","55877","Transluminal operation on iliac artery NOS","Other PAD procedures (3)",115,"Diseases of the Circulatory System",2,"271908013","265522007","394333010","cleansedreadcode"
"7A47.00","Peripheral Vascular Disease","9099","Other emergency bypass of femoral artery or popliteal artery","Other PAD procedures (3)",115,"Diseases of the Circulatory System",2,"394338018","405516005","2157318011","cleansedreadcode"
"7A47.11","Peripheral Vascular Disease","72491","Other emerg bypass femoral or popliteal art by anastomosis","Other PAD procedures (3)",115,"Diseases of the Circulatory System",2,"32181000006113","116360008","183983017","cleansedreadcode"
"7A47.13","Peripheral Vascular Disease","63238","Other emergency bypass of deep femoral artery","Other PAD procedures (3)",115,"Diseases of the Circulatory System",2,"349670013","116360008","183983017","cleansedreadcode"
"7A47.14","Peripheral Vascular Disease","39776","Other emergency bypass of popliteal artery","Other PAD procedures (3)",115,"Diseases of the Circulatory System",2,"349669012","116360008","183983017","cleansedreadcode"
"7A47.15","Peripheral Vascular Disease","97606","Other emergency bypass of superficial femoral artery","Other PAD procedures (3)",115,"Diseases of the Circulatory System",2,"349668016","116360008","183983017","cleansedreadcode"
"7A47.16","Peripheral Vascular Disease","11766","Other emergency bypass of femoral artery","Other PAD procedures (3)",115,"Diseases of the Circulatory System",2,"349667014","405463009","2157266019","cleansedreadcode"
"7A47000","Peripheral Vascular Disease","43651","Emerg bypass femoral art by fem/pop art anast c prosth NEC","Other PAD procedures (3)",115,"Diseases of the Circulatory System",2,"639431000006118","112828007","184069011","cleansedreadcode"
"7A47100","Peripheral Vascular Disease","67818","Emerg bypass popliteal art by pop/pop art anast c prosth NEC","Other PAD procedures (3)",115,"Diseases of the Circulatory System",2,"639581000006118","233384002","349710011","cleansedreadcode"
"7A47200","Peripheral Vascular Disease","52342","Emerg bypass femoral art by fem/pop a anast c vein graft NEC","Other PAD procedures (3)",115,"Diseases of the Circulatory System",2,"639421000006116","112828007","184069011","cleansedreadcode"
"7A47300","Peripheral Vascular Disease","60693","Emerg bypass pop art by pop/pop art anast c vein graft NEC","Other PAD procedures (3)",115,"Diseases of the Circulatory System",2,"639551000006114","233384002","349710011","cleansedreadcode"
"7A47400","Peripheral Vascular Disease","66820","Emerg bypass femoral art by fem/tib art anast c prosth NEC","Other PAD procedures (3)",115,"Diseases of the Circulatory System",2,"639451000006113","233383008","349706013","cleansedreadcode"
"7A47600","Peripheral Vascular Disease","96255","Emerg bypass femoral art by fem/tib a anast c vein graft NEC","Other PAD procedures (3)",115,"Diseases of the Circulatory System",2,"639441000006111","233383008","349706013","cleansedreadcode"
"7A47700","Peripheral Vascular Disease","66879","Emerg bypass pop art by pop/tib art anast c vein graft NEC","Other PAD procedures (3)",115,"Diseases of the Circulatory System",2,"639561000006111","233384002","349710011","cleansedreadcode"
"7A47B00","Peripheral Vascular Disease","62775","Emerg bypass pop art by pop/peron art anast c vein graft NEC","Other PAD procedures (3)",115,"Diseases of the Circulatory System",2,"639541000006112","233384002","349710011","cleansedreadcode"
"7A47C00","Peripheral Vascular Disease","48939","Emerg bypass femoral artery by fem/fem art anastomosis NEC","Other PAD procedures (3)",115,"Diseases of the Circulatory System",2,"639461000006110","116360008","183983017","cleansedreadcode"
"7A47D00","Peripheral Vascular Disease","70922","Emerg bypass popliteal artery by pop/fem art anastomosis NEC","Other PAD procedures (3)",115,"Diseases of the Circulatory System",2,"639601000006111","116360008","183983017","cleansedreadcode"
"7A47y00","Peripheral Vascular Disease","65692","Other emergency bypass of femoral or popliteal artery OS","Other PAD procedures (3)",115,"Diseases of the Circulatory System",2,"31361000006114","405516005","2157318011","cleansedreadcode"
"7A47z00","Peripheral Vascular Disease","68320","Other emergency bypass of femoral or popliteal artery NOS","Other PAD procedures (3)",115,"Diseases of the Circulatory System",2,"31351000006112","116360008","183983017","cleansedreadcode"
"7A48.00","Peripheral Vascular Disease","24692","Other bypass of femoral artery or popliteal artery","Other PAD procedures (3)",115,"Diseases of the Circulatory System",2,"394339014","405469008","2157272019","cleansedreadcode"
"7A48.11","Peripheral Vascular Disease","61974","Other bypass of femoral or popliteal artery by anastomosis","Other PAD procedures (3)",115,"Diseases of the Circulatory System",2,"349666017","405516005","2157318011","cleansedreadcode"
"7A48.12","Peripheral Vascular Disease","37787","Other bypass of common femoral artery","Other PAD procedures (3)",115,"Diseases of the Circulatory System",2,"349665018","405463009","2157266019","cleansedreadcode"
"7A48.14","Peripheral Vascular Disease","18060","Other bypass of femoral artery","Other PAD procedures (3)",115,"Diseases of the Circulatory System",2,"349663013","405463009","2157266019","cleansedreadcode"
"7A48.15","Peripheral Vascular Disease","12331","Other bypass of popliteal artery","Other PAD procedures (3)",115,"Diseases of the Circulatory System",2,"349662015","233384002","349710011","cleansedreadcode"
"7A48.16","Peripheral Vascular Disease","40732","Other bypass of superficial femoral artery","Other PAD procedures (3)",115,"Diseases of the Circulatory System",2,"349661010","405463009","2157266019","cleansedreadcode"
"7A48000","Peripheral Vascular Disease","27580","Bypass femoral artery by fem/pop art anast c prosthesis NEC","Other PAD procedures (3)",115,"Diseases of the Circulatory System",2,"530131000006113","312688006","1780381000000111","cleansedreadcode"
"7A48100","Peripheral Vascular Disease","64555","Bypass popliteal artery by pop/pop a anast c prosthesis NEC","Other PAD procedures (3)",115,"Diseases of the Circulatory System",2,"530811000006112","233384002","349710011","cleansedreadcode"
"7A48200","Peripheral Vascular Disease","28030","Bypass femoral artery by fem/pop art anast c vein graft NEC","Other PAD procedures (3)",115,"Diseases of the Circulatory System",2,"530141000006115","50807007","1780371000000114","cleansedreadcode"
"7A48300","Peripheral Vascular Disease","24097","Bypass popliteal artery by pop/pop a anast c vein graft NEC","Other PAD procedures (3)",115,"Diseases of the Circulatory System",2,"530821000006116","233384002","349710011","cleansedreadcode"
"7A48400","Peripheral Vascular Disease","39877","Bypass femoral artery by fem/tib art anast c prosthesis NEC","Other PAD procedures (3)",115,"Diseases of the Circulatory System",2,"530151000006118","233383008","349706013","cleansedreadcode"
"7A48500","Peripheral Vascular Disease","60465","Bypass popliteal artery by pop/tib a anast c prosthesis NEC","Other PAD procedures (3)",115,"Diseases of the Circulatory System",2,"530831000006118","233384002","349710011","cleansedreadcode"
"7A48600","Peripheral Vascular Disease","41823","Bypass femoral artery by fem/tib art anast c vein graft NEC","Other PAD procedures (3)",115,"Diseases of the Circulatory System",2,"530161000006116","448529008","2899845012","cleansedreadcode"
"7A48700","Peripheral Vascular Disease","48700","Bypass popliteal artery by pop/tib a anast c vein graft NEC","Other PAD procedures (3)",115,"Diseases of the Circulatory System",2,"530841000006111","233384002","349710011","cleansedreadcode"
"7A48800","Peripheral Vascular Disease","67982","Bypass femoral artery by fem/peron a anast c prosthesis NEC","Other PAD procedures (3)",115,"Diseases of the Circulatory System",2,"530111000006119","233383008","349706013","cleansedreadcode"
"7A48A00","Peripheral Vascular Disease","53675","Bypass femoral artery by fem/peron a anast c vein graft NEC","Other PAD procedures (3)",115,"Diseases of the Circulatory System",2,"530121000006110","448323005","2901040016","cleansedreadcode"
"7A48B00","Peripheral Vascular Disease","68412","Bypass popliteal art by pop/peron art anast c vein graft NEC","Other PAD procedures (3)",115,"Diseases of the Circulatory System",2,"530781000006110","233384002","349710011","cleansedreadcode"
"7A48C00","Peripheral Vascular Disease","45428","Bypass femoral artery by femoral/femoral art anastomosis NEC","Other PAD procedures (3)",115,"Diseases of the Circulatory System",2,"530171000006111","44662004","74498014","cleansedreadcode"
